Table S1. Inclusion and exclusion criteria;
Inclusion;Exclusion
Full text available in English, Portuguese, or Spanish.;All other languages
Empirical studies, defined as selection and analysis of primary data based in experiences in field or observation. ;Non-empirical articles (I.e.: Theoretical discussions, opinions, book reviews, systematic revisions and meta-analysis.
Studies focused on perception, emotions, and behaviors of older adults in outdoor built environment.; 
Studies published after 2007. (Publication of Global Age-friendly cities: a Guide, from WHO).;Studies published before 2007.
Studies that involve people with 60 years or more.;Studies that exclusively involve people under age of 60.
Full text available.;Ful text not available or not existent, (i. e.: conference abstracts).
